newspaper,category,title,url,content,date_scraped
Independent,Arts/Culture/Celebrities,"At Eurovision, politics once more intrudes upon this former pop lark",https://www.independent.co.uk/arts-entertainment/eurovision/eurovision-2025-review-uk-israel-austria-b2753000.html,"Viewers had plenty of time to revel in the bombastic anguish and madcap pop schemes on former ‘The Voice’ rejects, but politics still overshadows Eurovision’s post-war ideals I would like to be emailed about offers, events and updates from The Independent. Read our Privacy notice “We’re off to the races!” declares Graham Norton as the camp action gets underway at Basel’s St Jakob arena in Switzerland. And thus it falls once more to Eurovision to sashay into the bloody-toothed geopolitical scrum, plonk down a boombox playing the Vengaboys and try to get a savage world to sing about saunas for four hours. The ‘Vision, with its post-war ideals of unity through cheese-pop, wasn’t made for violent division within its ranks, nor at all ready for it. In recent, turbulent years it has become as much an international PR exercise as song contest, pinioned by its supposed non-political ethos as its participants make it ever more overtly political. This year, as in 2024, the main source of controversy is Israel’s involvement in the event through contestant Yuval Raphael. You might call it war-washing. You might argue that a global TV audience of 180 million should sense the level of solidarity abroad for the suffering Palestinian civilians, even through the TV feed’s “audio-sweetened” crowd noise. But there’s a sour note to what Norton calls “a mixed response” of cheers and jeers for Raphael herself on the night – a survivor of the 7 October terrorist attack on the Nova music festival who was selected by public vote as something of a national heroine. The song given to her by committee, “New Day Will Rise”, might even reflect the hopes of the general Israeli public for compassion, peace and renewal. “Everyone cries, don’t cry alone,” Raphael sings amid much Broadway bombast and slashes of Middle Eastern strings. “Life will go on… darkness will fade, all the pain will go.” That said, to sing it on an opulent, crystal-drenched staircase while our newsfeeds are full of emaciated Palestinian children in bombed-out homes still feels like a provocative move. “New day will rise,” great. But for everyone? Thankfully, producers have put Raphael on fourth, allowing plenty of time afterwards for viewers to pack their brains into cold storage and revel in the bombastic anguish and madcap pop schemes of the continent’s many regional The Voice rejects. Another major relief is that there’s been a significant scaling back in the sort of occult folk horror presentations that, since Sweden’s xenomorph crossbreed Loreen won in 2023, have made recent Eurovisions prime recruitment drives for Golden Dawn. The only serious hold-outs are Latvia’s Tautumeitas, six fire goddesses full of smiling menace, singing of “curses and hexes” and nature consuming the modern world, then growing monkey tails. The title of their glitch pop chorale “Bur Man Laimi” might translate as “A Chant for Happiness” but it sounds like an ominous evocation for Dead Can Dance to rise again and claim our souls. Instead, a sci-fi fantasy vibe prevails. Opening the evening, Norway’s Kyle Alessandro resembles Elliot Page starring in a musical Dune, roaming an Arabian pop volcano in post-apocalyptic warlord garb, flanked by hand-spinning mercenaries. Ziferblat, Ukraine’s elven village of an entry, resemble a Legends of Zelda game having come to life and become obsessed with the band Yes. And Poland’s Justyna Steczkowska and her crew of moon-worshipping S&M savages are even strafed by a fire-breathing dragon as she sings the song of the goddess Gaia herself, “creator of your DNA, your soul’s destruction and your salvation”. And an eternal deity who’s made it here having previously placed 18th in 1995 and co-hosted Polish Dancing on Ice. The theme for 2025, it seems, is The Elements. Fire and ice pyro and visuals abound, and there’s an entire nautical themed section an hour in. Austria’s impressive soprano JJ – looking to replicate the opera-pop success of last year’s winner Nemo – sets sail into stormy ballad waters on a boat made from bedroom detritus, giving his “Wasted Love” big cologne advert energy. Then Iceland’s Væb – dubbed the Viking Jedward – offer up some cheerier, cheesier seafaring fare with a song about rowing to Greenland on a Minecraft boat beneath leaping Lego dolphins. Later, Greece’s bespectacled chanteuse Klavdia sings of a mother mourning her daughter on the haunting “Asteromasta” while standing on a black pier above burning water. Ahab pop ahoy? In more traditional Eurovision quarters, The Netherlands’ Claude is the sole representative of the once ubiquitous overblown soul-pop balladeer, his “C’est La Vie” a poignant tale of his asylum seeker mother singing to him as a child, performed to his younger self in a mirror. The pop divas put on a strong fem-power showing. Luxembourg’s Laura Thorn, a marionette in a retro-futurist treehouse operated by giant CGI hands, delivers a superbly catchy cartoon twist on Sabrina Carpenter’s biting showgirl feminism. Malta’s Miriana Conte might have had her cunning ploy to slip the queer culture phrase “serving c***” into Eurovision foiled when the BBC insisted the easily-misheard original title of her entry “Kant” be changed to “Serving”, but she injects copious “queen energy” into its rap-pop celebration of forging one’s own riotous path. And, who knows, maybe the line “Why should we let other people decide when we could be having the time of our lives?” might somehow further the Europe-wide case for Universal Basic Income. Denmark’s Sissal seems to be singing the goth-flecked EDM of “Hallucination” from the depths of a K-hole meltdown – all blurred vision, paranoia and lack of control. Yet, love being her drug, she trips jubilant balls throughout. And Erika Vikman, representing both Finland and the more specialist corners of OnlyFans, is a Teutonic rave rock dominatrix whose (ahem) rousing “Ich Komme” is basically a Euro-“WAP”. Having already promised “my gates are open” and “I’ll dance with you even a wedding waltz, but naked”, she ends up riding a giant, spark-spewing golden microphone stand howling a simultaneous orgasm of a chorus like a phenomenally horny Andrew WK: “I scream out loud ‘I’m coming’ and together we come”. A harsh lesson in watching Eurovision with your parents and the subtitles on. After which, the understatement of Switzerland’s Zoë Më seems a refreshing Eurovision revelation: just her, a beautiful swell of chamber ballad and an arena of phone lights. France’s Louane also knows that less is amour, singing her touching ode to finding purpose in motherhood “Maman” (having lost her own parents in childhood) from inside a simple egg-timer set. These are certainly welcome feminine contrasts to Armenia’s none-more-macho PARG, running across the stage to the Imagine Dragons-aping “Survivor” looking like he's fresh from a fight to the death atop Mad Max’s battle tanker. It's a premium year for rock entries too. Lithuania’s Katarsis are probably the finest austere grunge goths ever to brave this arena of garish gimmickry. And Italy’s Lucio Corsi – a cross between 1973 Brian Eno and a malnourished Scarlet Pimpernel – brings probably the best song of the night in “Volevo Essere Un Duro”. It’s a Ziggy Stardust glam rock cracker played on a mile-long piano. There’s even an enlivening rock-off between previous rave metal entrants Käärijä and Baby Lasagna in the pre-voting interval. A kind of Eurogonks Assemble. But what, you ask, of the nutters? Well, the less said about Estonia’s rubber-limbed, coffee-loving Tommy Cash and his flapper cabaret catalogue of Italian cliches the better, but “Bara Bada Bascu” from Sweden’s besuited sauna bros KAJ is hooky enough to stand a chance of becoming the first novelty track to ever win. Even our own Remember Monday do us proud, strutting around a wonky chandelier like Frozen doing a Queen medley about owning your most Hasselhoff-sized blackouts. They hold their own in the jury voting too – receiving douze points from a creepy Italian mouse puppet will rival Churchill’s most stirring speeches in our nation’s proud history – even if the baffling public votes rob them of the showing they deserve. Against the odds, and thanks in large part to Switzerland’s three mildly demented presenters being so proud of their country having invented LSD, for the best part of four hours the joyous Eurovision spirit prevails and the unruly world seems a glittering neon curtain away. Until, in what Norton describes as “the most tense voting we’ve ever sat through”, a huge public phone-vote turnout for Israel makes for a highly charged final stand-off between Israel and Austria, and politics once more intrudes upon this formerly big fun pop lark. Ultimately Austria’s JJ prevails, the second successive opera-pop winner. Expect future Eurovisions to be awash with tracks resembling rave remixes of Tosca. And for the event to become ever more about optics than earworms.",2025-05-18
Independent,Sports,"Giro d’Italia Stage 9 preview: Map, standings and route to Siena",https://www.independent.co.uk/sport/cycling/giro-ditalia-2025-stage-nine-route-map-preview-b2752866.html,"Gravel sectors and lumpy parcours on Tuscan stage nine could be tailor-made to the Brit I would like to be emailed about offers, events and updates from The Independent. Read our Privacy notice Sterrato comes to the Giro d’Italia today as stage nine of the 2025 edition takes in some Strade Bianche-esque gravel sectors. There are even some shared sectors with the famous Classic - won by Tadej Pogacar in dominant fashion this year - in Monteaperti and Pinzuto, and five gravel sectors in total, with the longest two both 9.3km. Starting in Gubbio and heading through the Tuscan countryside to Siena, this should be both a fascinating stage to watch and also an incredibly hectic one as all the riders - particularly the GC contenders - look to stay safe on the five sterrato sections. Gravel has no respect for the pink jersey and the risks of punctures, crashes, and mechanicals all feel heightened on the uneven ground, while the dangers of being caught out of position will mean an almighty fight to be at the front. Like Strade Bianche it’s very up and down but the biggest climb is early on at La Cima, a category three 52km in, with another in San Martino in Grania on a sterrato section with 35km or so to go until the finish line in Siena. Other key moments include today’s Red Bull kilometre, at the end of Colle Pinzuto, a 2.5km gravel sector with 14km to go. Six, four and two bonus seconds are on offer there which an enterprising breakaway may well hoover up - or the GC contenders may come into play. The iconic Piazza del Campo plays host to the finish at the end of 181km of racing. Stage nine is scheduled to start at 1pm local time (12pm BST) and should conclude by 5.30pm local time (4.30pm BST). Mathias Vacek has been superb on all terrain in this race so far and had a more relaxed day on stage eight so should have fresher legs, while Dylan van Baarle has a fine Classics palmares and looked lively in the breakaway on Saturday. Inevitably plenty of riders will fancy this one but we’re going to throw our weight behind Tom Pidcock: a former winner of Strade Bianche, he’s evidently in good form after a strong Spring Classics campaign and a third place on a tough uphill sprint finish on stage five to Matera, and he’s made it clear he’s targeting this one. The 25-year-old has never won a senior Giro stage and only has one Grand Tour stage to his name, the famous Alpe d’Huez scalp in 2022, and would no doubt dearly like to add to that. Join thought-provoking conversations, follow other Independent readers and see their replies",2025-05-18
Independent,Sports,Cycling,https://www.independent.co.uk/sport/cycling,Please refresh the page or navigate to another page on the site to be automatically logged inPlease refresh your browser to be logged in Please refresh the page or navigate to another page on the site to be automatically logged inPlease refresh your browser to be logged in,2025-05-18
Independent,Sports,Fisher suffers nightmare KO by Allen as score is settled in rematch,https://www.independent.co.uk/sport/boxing/fisher-allen-2-result-knockout-highlights-rematch-b2753072.html,"After Fisher won a controversial decision in December, Allen left no doubt on Saturday – stopping his friend at the end of round five, as the towel also came in I would like to be emailed about offers, events and updates from The Independent. Read our Privacy notice Johnny Fisher was stopped by David Allen in the fifth round of their hotly anticipated rematch at London’s Copper Box Arena on Saturday. The pair met on home soil to settle the score, after a controversial result five months ago saw the scorecards declare Fisher the winner in Riyadh. In their first clash, Fisher emerged victorious on two of the judges’ scorecards with tight margins of 95-94. The third judge scored it 96-93 in favour of Allen, underlining just how closely matched the two heavyweights were that night. History repeated itself as Allen delivered a knockdown yet again in the fifth round – two this time, in fact. But, unlike the first time out, Fisher was put down for good on this occasion, as the second knockdown proved decisive right on the bell. The arena floor was bouncing as Fisher was announced in the ring, and as the bout played out, the “Romford Bull Army” continued to echo Fisher’s name around the venue. Fisher, who was pegged as the favourite to win, was doubling up on shots in the second round as he landed uppercuts to Allen’s body, but he was soon warned for tapping Allen on the head. Allen came back with some jab action, but the 33-year-old wasn’t bringing speed as his 26-year-old opponent was. From the corner, before round three, Allen told coach Jamie Moore, “I’ll be quicker,” before finding himself up against the ropes. Yet it was largely the “White Rhino” fighting on the front foot. Fisher looked like he was hurting Allen with numerous body shots, but during the fourth round his promise to Moore rang true, as Allen landed his first clean shot to the top of Fisher’s head. The fighters took opportunities thereafter, the bout intensifying as a left hook to the body landed for Allen and a right hook to the head landed for Fisher. Enjoy 185+ fights a year on DAZN, the Global Home of Boxing Never miss a fight from top promoters. Watch on your devices anywhere, anytime. ADVERTISEMENT. If you sign up to this service we will earn commission. This revenue helps to fund journalism across The Independent. Enjoy 185+ fights a year on DAZN, the Global Home of Boxing Never miss a fight from top promoters. Watch on your devices anywhere, anytime. ADVERTISEMENT. If you sign up to this service we will earn commission. This revenue helps to fund journalism across The Independent. The gruelling bout ultimately ended in round five, with a ferocious left hook sealing victory for Allen, who was left hungry for a win after the nature of his defeat in Saudi Arabia. Fisher could just not find his feet after the swift first knockdown in the fifth, and the second knockdown – on the bell, as the towel came in – proved decisive. With that, the result was not so controversial this time around. Allen refrained from celebrating, despite breaking his opponent’s unbeaten record, as paramedics immediately entered the ring to check on Fisher. Fisher was thankfully fine after some minutes, and the friends shared an embrace as the arena waited for Allen to receive his first title: the WBA Intercontinental heavyweight belt. Join thought-provoking conversations, follow other Independent readers and see their replies",2025-05-18
Independent,Sports,Boxing,https://www.independent.co.uk/sport/boxing,"Re-live the action after Dave Allen scored a devastating knockout of Johnny Fisher, leaving no doubt this time – after the latter’s controversial decision win in December",2025-05-18
Independent,Sports,Home hero Paolini makes Italian Open history with victory over Gauff,https://www.independent.co.uk/sport/tennis/jasmine-paolini-italian-open-coco-gauff-b2753025.html,"Paolini is the first home winner of the Italian Open in 40 years after a 6-4 6-2 victory in Rome I would like to be emailed about offers, events and updates from The Independent. Read our Privacy notice Jasmine Paolini became the first home winner of the Italian Open for 40 years with a dominant victory over Coco Gauff. The 29-year-old, who reached the final of the French Open and Wimbledon last year in a breakthrough season, delighted the fans at the Foro Italico with a 6-4 6-2 success. No Italian had won one of the two singles titles in Rome since Raffaella Reggi back in 1985 but Paolini thoroughly merited her triumph, while Jannik Sinner could make it a home double when he faces Carlos Alcaraz on Sunday. Paolini came out firing and edged a tight first set before running away with the second amid a slew of Gauff errors. By winning the title, Paolini guaranteed she will overtake Iga Swiatek to become world number four on Monday and therefore obtain a top-four seeding for the French Open, which begins next weekend. Gauff has returned to form on the European clay after a difficult few months but has finished runner-up in both the major events, with this loss following one against Aryna Sabalenka in Madrid a fortnight ago. Katie Boulter, meanwhile, reached the first clay-court final of her career at the Trophee Clarins in Paris. Dropping down to WTA 125 level, the tier just below the main tour, has paid off for the British number one, who defeated France’s Varvara Gracheva 6-0 3-6 6-3 to set up a final clash with another home player, Chloe Paquet. Join thought-provoking conversations, follow other Independent readers and see their replies",2025-05-18
