newspaper,category,title,url,content,date_scraped
BBC,Politics,Wales,https://www.bbc.com/news/wales,"One care home worker says Sir Keir Starmer's announcement feels ""like a betrayal of trust"". A rare lichen's last refuge on ancient oak felled by a storm puts a unique forest on the brink. Residents store water in containers to wash and cook with, as well as buying bottled water. Tory Senedd leader Darren Millar attacked Nigel Farage's Reform in conference speech. A man, 19, and a woman, 24, from Vale of Glamorgan were arrested on suspicion of drink-driving. A rare lichen's last refuge on ancient oak felled by a storm puts a unique forest on the brink. Ruth Jones was so sure she wasn't going to win a Bafta award that she removed her shoes. Beachgoers at Llanddwyn Beach on Anglesey, north Wales will soon pay up to £15 for parking. Residents store water in containers to wash and cook with, as well as buying bottled water. Police treating the disappearance of a woman as murder receive two new potential sightings. A charity says fires caused by substandard e-scooter and e-bike batteries are ""tearing through homes"". Jamie Roberts says he is ready to become a doctor and complete his medical training in the NHS. Cardiff's Lucie Jones represented the UK in the Eurovision grand final in Kiev in 2017. Paria Veisi, 37, was last seen on 12 April and was found dead a week later. The parents of a student who took her own life want to make sure people are supported with their care. A family looking to plant some vegetables in the garden instead dug up a thousand vintage bottles. A cafe owner in Sydney has transformed his bar into Australia's unofficial Wrexham supporters' club. Former staff and guests have come forward with their memories after an appeal to track down the faces featured in an exhibition. Ann and Bernard McDonagh had a carefully practised plan which they would act out each time. Nathan Osman's body was discovered the following morning at the foot of a remote cliff. Jamie Roberts says he is ""excited"" to become a doctor in hospitals across south Wales. A Ring doorbell captured the moment a murderer broke into a 69-year-old grandmother's house. New data shows record house price rises are currently ""centred"" in south Wales. Sir Keir Starmer accuses Plaid Cymru's parliamentary leader of talking ""rubbish"". Swansea City have completed the signing of Kilmarnock striker Bobby Wales on a four-year deal. Scarlets will travel to face Leinster in the United Rugby Championship play-offs following a 12-3 defeat against Sharks in Durban. Follow live text and listen to live BBC local radio commentaries from Division 1 and Division 2 of the County Championship. Lubabalo Dobela crosses in the 82nd minute to clinch victory for Lions over Ospreys in the United Rugby Championship. Bulls consolidate second place in the United Rugby Championship (URC) with an emphatic nine-try victory against depleted Dragons in Pretoria. Mae'n bosib fe allai nifer o gartrefi gofal orfod cau erbyn diwedd y flwyddyn, yn ôl rhai yn y sector gofal. Mae 'na bryderon bod coedwigoedd glaw Cymru yn diflannu a bod cennau a mwsoglau arbennig am ddiflannu hefyd. Mae Llywydd y Senedd yn edrych ymlaen at fod yn ""aelod drygionus ar y meinciau cefn"" pan ddaw ei chyfnod yn y rôl i ben. Y ffermwr a'r cyflwynydd sy'n siarad am broblemau iechyd meddwl ffermwyr a'r straen mae ef ei hun wedi brofi. Golwg ar draddodiadau 1 Mai yng Nghymru. Residents store water in containers to wash and cook with, as well as buying bottled water. Ruth Jones was so sure she wasn't going to win a Bafta award that she removed her shoes. A rare lichen's last refuge on ancient oak felled by a storm puts a unique forest on the brink. One care home worker says Sir Keir Starmer's announcement feels ""like a betrayal of trust"". A man, 19, and a woman, 24, from Vale of Glamorgan were arrested on suspicion of drink-driving. Beachgoers at Llanddwyn Beach on Anglesey, north Wales will soon pay up to £15 for parking. Tory Senedd leader Darren Millar attacked Nigel Farage's Reform in conference speech. Police treating the disappearance of a woman as murder receive two new potential sightings. Cardiff's Lucie Jones represented the UK in the Eurovision grand final in Kiev in 2017.",2025-05-18
BBC,Arts/Culture/Celebrities,"Eurovision 2025: Austria wins with last-minute vote, as the UK comes 19thAustrian counter-tenor JJ wins with Wasted Love, but the UK gets zero points from the public.9 hrs agoCulture",https://www.bbc.com/news/articles/c15nq75274qo,"Austrian singer JJ has won the Eurovision Song Contest in Basel, Switzerland, after a nail-biting finish that saw him topple Israel from pole position at the very last minute. The 24-year-old, who is a counter-tenor at the Vienna State Opera, took the title with the song Wasted Love, a tempestuous electro-ballad about unrequited love. ""Thank you so much for making my dreams come true,"" he said as he accepted the coveted glass microphone trophy. ""Love is the strongest force in the world, let's spread more love."" The singer scored 436 points, with Israel in second place on 357 and Estonia third on 356. The UK's act, Remember Monday, placed 19th with 88 points. For the second year in a row, the UK received zero from the public. JJ's younger sister broke through security guards to hug him after his victory was announced. The Austrian said his whole family had arrived to support him at the contest, including his 85-year-old grandfather, and a four-month-old niece, who watched outside with his brother. It is the third time Austria has won the contest, with previous victories going to Udo Jürgens' Merci, Cherie in 1966; and Conchita Wurst with Rise Like a Phoenix in 2014. JJ was inspired to take part in Eurovision by Conchita. The singer had always been one of the favourites to win, but the most hotly-tipped contestants were Sweden's KAJ - whose tongue-in-cheek ode to sauna culture, Bara Bada Bastu, ultimately took fourth place. Speaking after the show, JJ said he was ""so pleased"" that viewers had connected with his story of heartache. ""I wanted to let them have an insight on my deepest soul [and] how I felt when we wrote the song."" ""What I'm trying to commit [to] is that there's no wasted love. There's so much love that we can spread around. It's the strongest force on planet earth."" Asked how he would celebrate, he replied: ""Honestly, I need to sleep now. I'm tired."" For the second year in a row, there was controversy over Israel's participation, with protestors arguing for the country's dismissal over its military action in Gaza. Pro-Palestinian protests took place on the streets of Basel in the hours before the contest. Later, a man and a woman were prevented from invading the stage during Israel's performance. ""One of the two agitators threw paint and a crew member was hit,"" said Swiss broadcaster SRG SSR in a statement to the BBC. ""The crew member is fine and nobody was injured. ""The man and the woman were taken out of the venue and handed over to the police."" The performance, by young singer Yuval Raphael, was unaffected. The 25-year-old is a survivor of the Hamas attacks of 7 October, 2023, an experience which coloured her delicate ballad, New Day Will Rise. The Israeli delegation said Raphael was left ""shaken and upset"" by the incident, but that it was ""extremely proud"" of her performance ""which represented Israel in a respectful manner"". Elsewhere, Eurovision was its usual explosion of high camp, sexual innuendo and dresses being removed to reveal smaller, tighter dresses. Malta's Mariana Conte was forced to rewrite her disco anthem Serving Kant to remove what sounded like a swear word - but performed the censored version with a knowing wink, safe in the knowledge the audience would fill in the blanks. Although it was a fan favourite, Conte could only manage 17th. Estonia's Tommy Cash, who came third, also kept the innuendo train running, with Espresso Macchiato, a caffeinated disco anthem featuring the unforgettable phrase: ""Life is like spaghetti, it's hard until you make it."" Another highlight was Finland's Erika Vikman, who dispensed with double entendres entirely on Ich Komme, a vibrant hymn to sexual pleasure. The singer ended her performance by taking flight on a giant phallic microphone that shot sparks into the air. It thrust her into 11th position, and a permanent place in the Eurovision pantheon.  The contest also dealt with more weighty subjects like economic migration (Portuguese rock band Napa) and environmental catastrophe (Latvia's Tautumeitas, who scored 12 points from the UK jury). Dutch singer Claude delivered a heartfelt tribute to his mother in C'est La Vie - an upbeat anthem that reflected on her positivity as she uprooted the family from their home country of the Democratic Republic of Congo as a child. In a touching climax, the 21-year-old danced with an image of his childhood self in a mirror on the stage.  Also reflecting on their childhood was French singer Louane, whose tearjerking ballad was dedicated to her mother, who died of cancer when she was 17. In one of the night's most striking performances, she was surrounded by a whirlwind of sand as she hollered the word ""mother"" over and over again. One of the favourites to win, it ended the night in seventh place, after receiving a disappointing 50 points from the public. JJ's performance was similarly dramatic. Shot entirely in black and white, it saw him being tossed around on a rickety boat, as waves (of emotion) threatened to consume him. An honourable mention also goes to Italy's Lucio Corsi, whose harmonica solo in Volevo Essere Un Duro marked the first time a live instrument has been played at Eurovision since 1998. The UK spent a third year in the bottom half of the leaderboard, despite a spirited performance from girl group Remember Monday. A group of friends who met at high school, their inventive pop song What The Hell Just Happened? drew on their many years of experience in West End theatre. The girls pulled off their tricky three-part harmonies while dancing around a fallen chandelier, but the performance didn't connect with voters. Despite earning a healthy 88 points from juries - including 12 from Italy -  it bombed with viewers. They ended in 19th place, one below last year's entrant Olly Alexander. The group laughed off their ""nul points"" score from the public, holding up peace signs and hugging each other as the score was announced. The voting was utter chaos. Thirteen of the 26 finalists received the maximum of 12 points from at least one jury, leaving the competition completely open before the public vote was counted. Israel, who had been languishing in the bottom half of the table, then received 297 points from the public (out of a possible maximum of 444). Twelve of those points came from the UK. For a while, it looked like Yuval Raphael's lead might be unassailable - but Austria's tally of 178 was the last to be announced, leaving the singer empty-handed. And spare a thought for Switzerland. Their contestant, Zoë Më, was in second place after the jury vote, with 214 points. Then the public gave her the night's only other zero-point score. To gasps in the arena, her song Voyage was demoted to 10th place. There was disappointment, too, for fans of Canadian singer Céline Dion, who had been rumoured to appear at the contest. The singer won Eurovision for Switzerland in 1988, and had appeared in a video wishing the contestants good luck at Tuesday's semi-final. Despite hopes from Eurovision organisers that she might turn up, the moment never came to pass. ",2025-05-18
BBC,Arts/Culture/Celebrities,Elton brands government 'losers' over AI copyright plansThe musician accuses the government of robbing young artists over its copyright law plans.3 hrs ago,https://www.bbc.com/news/articles/c8jg0348yvxo,"Sir Elton John described the government as ""absolute losers"" and said he feels ""incredibly betrayed"" over plans to exempt technology firms from copyright laws. Speaking exclusively to Sunday with Laura Kuenssberg, he said if ministers go ahead with plans to allow AI firms to use artists' content without paying, they would be ""committing theft, thievery on a high scale"". This week the government rejected proposals from the House of Lords to force AI companies to disclose what material they were using to develop their programmes. A government spokesperson said that ""no changes"" to copyright laws would be ""considered unless we are completely satisfied they work for creators"". Generative AI programmes mine, or learn, from vast amounts of data like text, images, or music online to generate new content which feels like it has been made by a human. Sir Elton said the ""danger"" is that, for young artists, ""they haven't got the resources ... to fight big tech [firms]"". ""It's criminal, in that I feel incredibly betrayed,"" he added. ""The House of Lords did a vote, and it was more than two to one in our favour,"" he said. ""The government just looked at it as if to say, 'Hmm, well the old people ... like me can afford it.'"" On Monday, the House of Lords voted by a 147 majority to amend the Data (Use and Access) Bill to add transparency requirements, which aim to ensure copyright holders have to give permission for their work to be used. But on Wednesday MPs in the House of Commons voted to reject this change, meaning the bill will continue to go back and forth between the two Houses until they reach an agreement on it. Sir Elton warned the government was on course to ""rob young people of their legacy and their income"", adding that he thought the government was ""just being absolute losers, and I'm very angry about it"". The singer said that Prime Minister Sir Keir Starmer needed to ""wise up"" and described Technology Secretary Peter Kyle as ""a bit of a moron"". He said if the government does not change its plans, he would be ready to take ministers to court, saying that ""we'll fight it all the way"". Speaking alongside the 78-year-old, playwright James Graham said ministers ""do understand the value of creativity... but what's frustrating is either the complacency or the willingness to let Silicon Valley tech bros get it all their own way"". The chief executive of UK music, Tom Kiehl, told the BBC that the government is ""on the brink"" of offering up the country's music industry ""as a sacrificial lamb in its efforts to cosy up to American-based tech giants"". He added that the prime minister ""must not sell"" the next generation of singers, songwriters, musicians, and music creators ""down the river and allow all that talent to be crushed by letting soulless AI bots plunder their work"". Ahead of the vote in the House of Lords, Sir Elton joined more than 400 British musicians, writers, and artists in signing a letter calling on the prime minister to update copyright laws in a way that protects them from artificial intelligence. Beatles singer Sir Paul McCartney, who also signed the letter, previously told the BBC there was a risk AI would create a ""Wild West"" in which artists' copyright was not properly protected. A government spokesperson said it wants the UK's creative industries and AI companies to ""flourish, which is why we're consulting on a package of measures that we hope will work for both sectors"". The spokesperson said it was ""vital"" the government worked through responses to a consultation on proposals to allow developers to use creators' content unless rights holders elected to ""opt out"". They added that it was ""equally important that we put in the groundwork now as we consider the next steps"". ""That is why we have committed to publishing a report and economic impact assessment - exploring the broad range of issues and options on all sides of the debate."" The full interview with Sir Elton John will be on Sunday with Laura Kuenssberg on Sunday 18 January at 09:00 BST. Sign up for the Off Air with Laura K newsletter to get Laura Kuenssberg's expert political insight and insider stories every Thursday.",2025-05-18
BBC,Arts/Culture/Celebrities,Doom: One of gaming's oldest series reckons with the challenges of 2025Doom is one of the most well-known series in gaming but it still has to work to find new players.1 day ago,https://www.bbc.com/news/articles/c4gezq2q911o,"Few names are as synonymous with video games as Doom. First launched in 1993, the first-person shooter (FPS) remains one of the most influential - and popular - series in the industry. But even it and its superhuman protagonist, The Doom Slayer, have to contend with the pressures of the games industry in 2025. Attracting new players, competing with the new titans on the scene and the rising cost of making - and selling - blockbuster titles. BBC Newsbeat spoke to the project leaders of the latest instalment, Doom: The Dark Ages, about navigating some of these challenges. While the Doom series is famous for pitting players against colossal enemies, there are other behemoths it has to face. ""There's so much stuff competing for our attention these days, whether it's games, movies, or whatever,"" says executive producer Marty Stratton. Free-to-play (F2P) games, such as Fortnite and Roblox, and annually updated series such as Call of Duty and EA FC regularly dominate most-played charts. There's evidence to suggest players, particularly younger ones, are spending most of their time on these titles - sometimes referred to as ""forever games"". In the latest Online Nation report by UK regulator Ofcom, five of the top ten games among UK players were F2P. Fortnite recorded about 2.65m active UK users in May 2024, and Roblox 1.22m, according to the report, and global figures are much higher. Drawing those players to premium titles can be a challenge but Marty argues games such as Doom, which can be completed in under 20 hours, can ""fit into those habits"". ""It doesn't have to become your obsession for the next two years,"" he says. The Doom series - developed by Dallas-based ID Software - has an advantage over others because it's so well-known and has a large, loyal fanbase. But, as industry expert Rhys Elliot, from Alinea Analytics, tells Newsbeat, it's getting harder to rely solely on your hardcore players. Overall, he says, the number of people playing premium titles isn't increasing, but the cost of making them is. ""The people who make games - they still need to make revenues each year because, you know, capitalism,"" he says. One way of doing this is by attracting new players. Doom's director Hugo Martin says the response to Doom: The Dark Age's previews were encouraging - something he puts down in part to its new ""Medieval sci-fi"" setting and altered gameplay style. ""We see it in the comments - a lot of people are saying 'I think this is going to be my first Doom', and that's exciting for us,"" he says. The games industry has also leaned into customisation in recent years, giving players the power to finely tweak different elements and aspects of difficulty - something that's been incorporated into The Dark Ages. ""In that regard I think it's going to be a great first-time experience for a lot of fans,"" says Hugo. But there's still the small matter of the cost of entry. The debate over prices has been a feature of gaming discourse for years. In 2010, a new game cost roughly £40 in the UK - and players had plenty to say about it at the time. If you take into account inflation (using this Bank of England tool), that would be about £60 in today's money. Doom: The Dark Ages itself costs £69.99 for a standard edition or almost £100 for a limited Premium Edition with extras included. ""When you look at the history of game pricing... it really hasn't skyrocketed,"" says Marty. The issue has been thrown back into the spotlight thanks to worries over Donald Trump's tariff plans and price announcements from the three major console makers. That could make competitors such as Fortnite - which don't require new, specialised hardware to run - even more appealing for cash-strapped players. But Doom producer Marty argues that ""free"" games can end up costing players more in the long run, while there are ""no unknown expenses"" with a one-off purchase such as Doom. ""You're not going to be asked to pay anything else, two hours in,"" he says. F2P games generate cash with in-game purchases, ranging from ""microtransactions"" equivalent to a handful of change or, in some cases, hundreds of pounds. Those costs can mount up, and a recent poll of 2,001 gamers by British bank TSB suggested dedicated players can spend about £22 a month on those transactions. That's still less than a tentpole new release, but Doom's director Hugo also believes people are happy to pay more for a ""curated experience"" with ""replay value"". ""Typically, if you just make a really good game then people will want to play it again,"" he says. Analyst Rhys believes we're going to see more ""fiddling with prices"" and surcharges ""to see what customers are willing to pay"" and a wider range of RRPs for new releases. ""Hopefully there'll be more competition there. It's good for consumers,"" he says. Doom is also available on PC and Xbox via Game Pass - Microsoft's Netflix-style subscription priced at £14.99 a month. There's evidence more people are turning to this, as well as Sony's PlayStation Plus - raising questions over whether they put players off paying full price. Game Pass players could pay a £34.99/$34.99 upgrade fee to access the game two days early and receive bonus content. Rhys says we are likely to see more of these sorts of offers are aimed at ""superfans"" who want to keep up with the latest releases. For everyone else, waiting is an option. ""You can pick up the first 2016 Doom game for like £4 right now,"" says Rhys. Doom's makers, perhaps unsurprisingly, believe their latest is worth jumping into. ""We think about price when we're developing it - we obviously want the value to be there for players,"" says Marty. ""Ultimately, it's a market. Players will determine what they want to spend."" ""I think it's there's obviously still a place for a good, premium, highly polished, fun single-player game,"" adds Hugo. Listen to Newsbeat live at 12:45 and 17:45 weekdays - or listen back here.",2025-05-18
